{
  "k": "avanti",
  "title": "Andando avanti",
  "icon": "📈",
  "content": "### **Gestione PG**\n\n\n\nIl personaggio alla creazione parte dal livello 1, fino al livello 4 (compreso) si ha diritto a un cambio pg senza perdere livelli per **situazioni eccezionali **(cosa che verrà valutata dal corpo Master), questo è un privilegio usabile solamente una volta per tutta l'esperienza nel server.\n\nLa procedura standard in caso di morte del PG, ritiro di  esso o cambio standard a disposizione del player sarà:\n\n- **LV Vecchio PG - 1 **e **Metà del Valore Totale di Bag**\nQuindi la procedura standard di cambio PG rimarrà invariata\n\n\n\n---\n\n## Checkpoint – Livello 5\n\n\n\nRaggiunto il livello 5, ottieni accesso ad 1 modifica del personaggio, con la quale potrete modificare:\n\n\n\n- Sottoclasse\n- Talenti\n- Punteggi di caratteristica\n- Allineamento\n\n\nL’utilizzo della modifica verrà indicato sulla **Tessera Avventuriero** con un simbolo dedicato, che sarà barrato (X) una volta utilizzato.\n\n👉 Ripetiamo che q**uesta modifica può essere usata una sola volta per personaggio**, a partire dal livello 5.\n\n\n\n\n\n\n\n\n\n\n\n",
  "lastModified": "2026-08-03T09:23:06.819838Z"
}