{
  "k": "farmacia",
  "title": "Bottega farmaceutica",
  "icon": "🧪",
  "content": "![](https://prod-files-secure.s3.us-west-2.amazonaws.com/fba0274f-dc1c-8128-a70c-0003af9f37a4/b7325fa1-18f7-4d24-9782-cd372aed57e9/2aebdb3b-5755-44c9-bef5-8c4a3268bcf2.webp?X-Amz-Algorithm=AWS4-HMAC-SHA256&X-Amz-Content-Sha256=UNSIGNED-PAYLOAD&X-Amz-Credential=ASIAZI2LB466Y7LQI35N%2F20260803%2Fus-west-2%2Fs3%2Faws4_request&X-Amz-Date=20260803T092835Z&X-Amz-Expires=3600&X-Amz-Security-Token=IQoJb3JpZ2luX2VjECgaCXVzLXdlc3QtMiJIMEYCIQDvIrToZ%2FM44ThpKLBLQ0eGnGAM3vzlm2KwXz%2B9Y60tUgIhAITRdiMPdG3iY1Pkqi5DQJEwkutsHcmZtbufqAoGw1wpKogECPH%2F%2F%2F%2F%2F%2F%2F%2F%2F%2FwEQABoMNjM3NDIzMTgzODA1IgyCPKTHjTV4QMZoXZwq3AM7N1PEQsyG0NWcbvGGvZsK2m%2FJ6EzyQ3HmJ0%2F%2F458w5ZBxNOQNhsl3TU%2FxWP%2BXB8weGq%2FShsSf%2BaFtUIiS4lbHRSvNgKfJwfze67oarspQWQkgJE4QOd06hSMUxTLkmQ4jtdepsuk5flIiCDqHpYhbArNCqu%2BgvKHQ1yPUt1V3mAVGI6ym12Ez%2Brn9Gy9XayaCV2oG6RCKD9OdgRztvP0neQnfHPVHqkPmp%2B1leSGqJbqmfgbsynAcHTmBUaiTOuE3dsl1lmsRX3CTwacml5cy170lUwmMRuwPaHfHFC7E6M72llHc7bRv%2BYiyWcGuSoxYzDpWg1nY0T5i2qS6khnB2kgGWhFlYaA386SJQLgNZZ3C26R21aPFQzh62rTcZ1QSHfLeoRxLIsjVLOz4BFpZj9SSuAyH1d70InWdrZjG0TCNHtWnobKWPN0nkq%2BmhXWEEeGBDllUI9Y72YTHp2B4mk529oDnpB92ij9CuGcOxlhlcUAbUIrUvPalR4zJYwPTTLfNyIF%2FNQEWRKTadANu6RNFp%2F8CQZ4kaanDIeC1IHBs%2BGHKFl6v39gX%2FiptiRoNo%2BTQUZOpstxHFaHCPjXmq9jS53Wty1vbdJy2GcSUBghbDBQpOsakfBOYgDCmh8HTBjqkAbAFtSmrzByOqFfy0joVMkZDXevNafLZFrj4P7fleLTblwuoVWOoe3dxJto%2FTGW01tzd6%2Bc1jldBcwJ1dCnZYk6IyAXsqxYHcvLgP2NV9I%2B%2BlLLS7%2FSEz5KLFSUi%2FGzuzEiB%2BcTrGrJ7mvMTlLx4fThJ1SkaosiZcC3pjfoE3aZmR2K%2FLosg51RvFPAd9YOFhxT2w22zeWQUOSSGX93%2FOHHyAllA&X-Amz-Signature=1935a9e40984ba785e366dc25117a2d0f0c7f966a4400634732eb4b5a32f9367&X-Amz-SignedHeaders=host&x-amz-checksum-mode=ENABLED&x-id=GetObject)\n\n",
  "lastModified": "2026-08-03T12:00:00Z"
}