{
  "k": "gilda",
  "title": "Gilda degli avventurieri",
  "icon": "🗡️",
  "content": "\n\nTutti i prodi avventurieri devono passare da questo posto per ottenere le loro missioni.\nUn messaggio affisso, dal capo del Corpo degli Avventurieri, sul banco principale:\n\n\n`\"Al fine di garantire un'esperienza equa per tutti, chiunque lavori come Avventuriero non può lavorare come membro del nostro staff e viceversa.\nVi ringraziamo per la pazienza. ~Kerios\" `\n\n\nEssendo la Locanda parte dello stesso edificio, in caso i posti a sedere fossero pieni, i tavoli della Gilda degli Avventurieri possono essere sfruttati per sedersi a mangiare.\n\n\n\n---\n\n![](https://prod-files-secure.s3.us-west-2.amazonaws.com/fba0274f-dc1c-8128-a70c-0003af9f37a4/e02e0525-c1a7-4c72-8f3d-c74489ff6b43/DALLE_2025-03-13_21.55.10_-_A_grand_medieval_fantasy_adventurers_guild_hall_bustling_with_activity._The_large_wooden_hall_is_adorned_with_banners_and_trophies_from_past_quests.webp?X-Amz-Algorithm=AWS4-HMAC-SHA256&X-Amz-Content-Sha256=UNSIGNED-PAYLOAD&X-Amz-Credential=ASIAZI2LB4667UYMEVYM%2F20260803%2Fus-west-2%2Fs3%2Faws4_request&X-Amz-Date=20260803T092319Z&X-Amz-Expires=3600&X-Amz-Security-Token=IQoJb3JpZ2luX2VjECgaCXVzLXdlc3QtMiJIMEYCIQCmR7WnhxIbjPsGz32vnBzfdljXzVDN6VnT4Q7ZqbK%2B5QIhAKRhQBd%2FLO%2BmMzopnaCKuU7tG%2B1ZoCs6Ap58OEjFKCd4KogECPH%2F%2F%2F%2F%2F%2F%2F%2F%2F%2FwEQABoMNjM3NDIzMTgzODA1IgzLIB1QXfkBQTWrlY8q3AMEZBhDns%2B1W3DrWWWzqF0SDr7Kyct%2BaZFGlNwoUPz7VMlEOnUQTjJ6ZIJybO4rrC%2FQHkroiTGIRmDanEhGhFKR1gqqGcD4DreCImq6%2Fm9HNuzy%2BhN2sQLc3Sx2q8wJ02E2ZgiTJuDxmTnQvkezqCQgexNrTsw%2BLL2V2POggSX7QCx6tzaizgwVlRUgWTSUkjKdDzXZPg7cHinJDNxrq1KVI8L8k%2BzFywxu%2FoBAZbtMuR%2Bk%2F%2BuOylhST9flfbmIsoamXKx%2BVSLsjvguDJ7whEUmp939HDUFKGxQWgZ5Rfw2N%2Bwi0rln2TLcG5Lf8VLpkdoBIpW85zQiELCd8xY5z1n8CZu8MsS%2F6OWJSB6OhMmCTdUB6MTOJ2DHsUwxW4D0te0sk%2BY%2BndxGtdHy9p%2F3JOnf09xEmMD2FRC7FQNm%2FzIJ5dwSBmfQ0m%2Fy4MIFtxyircIG2TGPXTyyRu%2FKHeOdp8DtzghZYhOYDVGqNIH9ly%2F46m0uN23IgZVnWGzsATduo0%2BajOwdAbdv7H1tceIZ%2BtO6R9Xc1CUG%2FsVXEWxLlWKauhdBIYciW1qg2h1ETnWdXXS2HUS8nrG40Fqcrdcvs2Oy%2FZVRKNjiaAFRFVViC3%2FnJxbJubxvWfyJhkLdoTDkicHTBjqkAfmgXBetOeViLp7EGUHk49t2IQu7jImdxRYUrDHvmUNZTSa3u%2BPvvtqy548psbwrP7Gh6lWFUcKRAeUrxOmE9eDpHcglScMiNqCwXj%2Berp7D%2FmJkTz0yFMIY3BlpYLx91vxBinyntrzbvhKhZ82yePGjdVfCaZyrPnBf3NL469eKlnxrGnQyl2pCLoraKcm7SqfqFx4FRRxbhvJYnIrwv2CLU3Ux&X-Amz-Signature=0b2d92cf17c8917f6f952554abc66ac9d54717882507bb0658db57a829a69c9a&X-Amz-SignedHeaders=host&x-amz-checksum-mode=ENABLED&x-id=GetObject)\n\n\n\n",
  "lastModified": "2026-08-03T09:23:19.660608Z"
}