{
  "k": "maestria",
  "title": "Maestria / Titoli",
  "icon": "🔨",
  "content": "[📄 Casate e Compagnie ]\n\n[📄 Compagnie Mercantili]\n\n[📄 Ordine Kikri]\n\nUn antenato dell’ordine Kinkou, proveniente dalle antiche terre presenti oltre il regno di Arcadia\n\n\n\n",
  "lastModified": "2026-08-03T12:00:00Z"
}