{
  "k": "gameplay",
  "title": "Gameplay",
  "icon": "⚔️",
  "content": "# Gameplay\n\n## Cos'è Arcamis?\n\nArcamis è un server Discord dedicato al gioco di ruolo **Dungeons & Dragons 5ª Edizione**. Il mondo di gioco, chiamato **Aetherion**, è un setting homebrew ricco di lore, fazioni e avventure.\n\n## Come Giocare\n\n### Creare un Personaggio\n\n1. Scegli una **specie** tra quelle disponibili (vedi Homebrew)\n2. Scegli una **classe** e una sottoclasse\n3. Assegna i punteggi di attributo\n4. Scrivi il background del tuo personaggio\n5. Registrati nel canale dedicato\n\n### Regole Base\n\n> Le regole ufficiali di D&D 5e si applicano a meno che non sia specificato diversamente nelle pagine di Homebrew.\n\n**Punteggi di Abilità:**\n- **FOR** (Forza) — Attacchi fisici, portare pesi\n- **DES** (Destrezza) — AC, tiri iniziativa, furtività\n- **COS** (Costituzione) — PF, tiri salvezza\n- **INT** (Intelligenza) — Conoscenze, arcana\n- **SAG** (Saggezza) — Percezione, medicina, religione\n- **CAR** (Carisma) — Persuasione, intimidazione\n\n### Progressione\n\n| Livello | XP Required | Proficiency Bonus |\n|---------|-------------|-------------------|\n| 1 | 0 | +2 |\n| 2 | 300 | +2 |\n| 3 | 900 | +2 |\n| 4 | 2,700 | +2 |\n| 5 | 6,500 | +3 |\n\n---\n\n*Ultimo aggiornamento: Agosto 2026*",
  "lastModified": "2026-08-03T12:00:00.000Z"
}
