{
  "k": "regole",
  "title": "Regole",
  "icon": "📜",
  "content": "Anche se le regole sono scritte nelle due pagine sottostanti, facciamo una breve ricapitolazione.\n\n\n---\n\n\n\n1) Vietato qualsiasi comportamento considerato e considerabile “Negativo” (A discrezione del giudizio dello staff);\n\n2) Niente meta-game (essere tossici sul gameplay altrui, infrange sia la regola 1 che questa);\n\n3) Niente spam (di qualsiasi tipo) e flood (spammare messaggi);\n\n4) No NSFW;\n\n5) Vi permettiamo di avere item particolari che non vi diano vantaggi di alcun tipo nel gameplay. Questi item non sono vendibili, barattabili, scambiabili e non potranno esservi rubati (diciamo che hanno una sorta di collegamento inscindibile col pg).\n\n\n\n[📄 Regole off-game]\n\n### 1) Accesso al Server\n\n\n\nEntrando nel server dichiari di essere **maggiorenne** e accetti di sollevare lo staff da qualsiasi responsabilità per i contenuti condivisi dagli utenti.\n\n---\n\n### 2) Comportamento Fuori dal Gioco\n\n\n\nLe norme di buon senso valgono anche fuori dal roleplay.\n\nSono vietati:\n\n- comportamenti offensivi, molesti o dannosi verso altri utenti\n- pubblicazione di materiale NSFW in canali non dedicati\n---\n\n### 3) Spam e Pubblicità\n\n\n\nQualsiasi forma di spam o autopromazione è vietata senza previa approvazione dello staff.\n\n\n\n**Eccezione:** gli artisti possono pubblicare i propri lavori nei canali appositi.\n\nLink, file e documenti non richiesti restano vietati in ogni caso.\n\n---\n\n### 4) Metagame\n\n\n\nLe dinamiche personali fuori dal gioco non entrano in partita, e viceversa.\n\nAntipatie, conflitti o amicizie IRL non influenzano — e non devono influenzare — le interazioni in gioco.\n\n---\n\n### 5) Privacy\n\n\n\nLo staff non richiede mai dati personali.\n\nSe qualcuno vi chiede informazioni personali spacciandosi per membro dello staff o per qualsiasi altro motivo, **segnalatelo immediatamente con prove** al team di moderazione.\n\n---\n\n### 6) Contenuti Illegali o Piratati\n\n\n\nÈ vietato condividere qualsiasi contenuto relativo a:\n\n- materiale illegale o piratato\n- opere coperte da copyright senza autorizzazione\n- software ottenuto illegalmente\n---\n\n### 7) Impersonificazione\n\n\n\nÈ vietato fingersi un altro utente o membro dello staff, incluso l'uso di nomi simili o immagini profilo ingannevoli.\n\n---\n\n### 8) Uso dei Canali\n\n\n\nOgni canale ha uno scopo specifico. Usatelo per quello che serve, non per altro.\n\n---\n\n### 9) Contenuti Homebrew\n\n\n\nPrima di proporre materiale homebrew, assicuratevi di volerlo effettivamente usare in gioco e siate pronti all'eventualità che non venga approvato. L'approvazione non è garantita.\n\n\n\n[📄 PVP]\n\n### Arena\n\n\n\nL'arena è protetta da rune che simulano un riposo parziale al termine di ogni scontro. Quando un personaggio scende sotto 0 HP:\n\n- il combattimento termina immediatamente\n- entrambi i contendenti vengono riportati alle condizioni precedenti allo scontro (HP, slot incantesimo e condizioni di status)\nGli scontri in arena **non possono concludersi con un PK**.\n\n---\n\n### PvP e PK \n\n\n\n1) Regole generali\n\n\n\nIl PvP è consentito. Il PK (Player Kill) è consentito fuori dall'arena.\n\n**Ogni scontro tra personaggi deve:**\n\n- essere supervisionato da almeno un Dungeon Master\n- essere coerente con la narrativa, il contesto e le dinamiche in gioco\n- avere motivazioni valide (vedi sotto)\n\n\n2) Motivazioni Valide per PvP e PK\n\n\n\nSono accettate motivazioni come:\n\n- conflitti narrativi sviluppati nel tempo\n- rivalità politiche, religiose o ideologiche\n- tradimenti, vendette o scelte con conseguenze narrative chiare\n- eventi rilevanti introdotti dalla narrativa\n**Non sono motivazioni valide:**\n\n- noia o impulso del momento\n- provocazioni senza sviluppo narrativo precedente\n- conflitti o antipatie tra giocatori fuori dal gioco\nQualsiasi azione motivata da dinamiche OOC è vietata.\n\n\n\n3) Ruolo dei Dungeon Master\n\n\n\nUn DM può introdurre elementi narrativi per generare tensione o conflitto tra personaggi. Anche in questo caso valgono le stesse regole: le motivazioni devono essere logiche e giustificate narrativamente, e il conflitto deve avere uno scopo di gioco — non essere punitivo o arbitrario.\n\nI DM sono soggetti a questo regolamento e possono essere sanzionati in caso di abuso.\n\n---\n\n## Conseguenze di un PK Non Autorizzato\n\n\n\nSe un PvP o PK avviene senza motivazioni valide, senza supervisione, o su base metagame:\n\n- la kill viene invalidata\n- le conseguenze narrative vengono annullate\n- il giocatore responsabile è soggetto a sanzione\n- se il metagame è accertato, anche il personaggio può subire conseguenze, a discrezione dello staff\n[📄 Regole in-game]\n\n### **1) Erotic-Roleplay (NSFW)**\n\n\n\n- Vietato in qualsiasi canale, senza eccezioni.\n---\n\n### **2) Comportamenti dello staff**\n\n\n\n- Qualsiasi comportamento anomalo da parte di un membro dello staff va segnalato alla moderazione tramite ticket.\n**Nota:**\n\nLe segnalazioni prive di prove concrete non possono essere istruite. Documentate prima di segnalare.\n\n---\n\n### **3) Modifiche a Scheda, Inventario o Borsa**\n\n\n\n- Qualsiasi modifica richiede la supervisione dello staff.\n- Agire autonomamente è considerata una violazione delle regole di gioco.\n- In caso di anomalie rilevate, le sanzioni possono essere severe.\n\n\nSe dovessimo scoprire anomalie, le punizioni potrebbero essere molto severe.\n\n---\n\n### **4) Roleplay nei canali dedicati**\n\n\n\n- Tutto il roleplay va condotto esclusivamente nelle stanze apposite.\n---\n\n### **5) Oggetti Speciali**\n\n\n\n- È consentito interpretare personaggi con abitudini particolari (es. un personaggio che porta sempre con sé un sacchetto di caramelle).\n- Gli oggetti che generano liquidi o solidi sono ammessi per uso personale. La vendita dei relativi prodotti è vietata.\n---\n\n### **6) Regole sui Thread**\n\n\n\n- Usate i Thread per isolare scene specifiche ed evitare di intasare i canali generali.\n\n\n**Quando creare un Thread:** ogni volta che una scena coinvolge due o più personaggi in un'interazione prolungata (una trattativa, un dialogo, un confronto) che non riguarda gli altri presenti nel canale.\n\n---\n\n### **7) Regole PBC (Play By Chat)**\n\n\n\n**Prima dell'inizio:**\n\n- Il Master pubblica la sessione indicando la propria fascia oraria disponibile.\n- I giocatori selezionati comunicano nel canale del Master gli orari in cui sono difficilmente raggiungibili.\n**Durante la sessione:**\n\n- In combattimento: chi non risponde entro 20–30 minuti nel proprio turno lo perde (a discrezione del Master).\n- Chi si assenta per più di 5 ore senza comunicarlo può essere escluso dalla sessione a discrezione del Master.\n- In caso di esclusione, l'EXP assegnato può essere ridotto proporzionalmente (es. 50% per partecipazione parziale).\n> Una comunicazione anche minima — *\"oggi sono rallentato\"*, *\"rispondo stasera\"* — è sufficiente per evitare l'esclusione.\n\n---\n\n### **8) Requisiti per Partecipare alle Sessioni**\n\n\n\n- **Iscrizione alla Gilda degli Avventurieri** — le missive disponibili sono affisse alla bacheca dedicata.\n- **Quota mensile** — copre l'accesso alle missive, l'assistenza sanitaria e legale al personaggio, e un documento di riconoscimento valido in tutto il mondo di gioco.\n- **Disponibilità responsabile** — chi si iscrive a una sessione (PBV o PBC) si impegna a contribuire a un ambiente di gioco collaborativo e rispettoso, comunicando tempestivamente eventuali assenze.\n- **Problemi con un Master** — aprire un ticket nella sezione dedicata, descrivendo il problema in modo chiaro. Ogni segnalazione verrà gestita assieme.\n\n\n---\n\n# Come gestiamo la moderazione?\n\nBeh… provate ad infrangere le regole e scopritelo. Non ve lo spoileriamo, non vogliamo rovinarvi la sorpresa.\n\n",
  "lastModified": "2026-08-03T09:22:53.002987Z"
}