{
  "k": "la-storia-di-gandora",
  "title": "La Storia di Gandora",
  "icon": "🐉",
  "content": "# La Leggenda di Gandora e l'Antro dell'Oblio\n\n> \"In un tempo ormai perduto Gandora, operatore di questo sito, creò \"Gandora il Drago dell'Esilio\" come protettore della land contro gli account Discord spammer o fasulli. Il compito era di tale gravità che il creatore gli diede il suo stesso nome per fornirgli potere sufficiente per eseguire tale impresa...\"\n\n\n## La creazione della Trappola Sacra\n\nI confini della Land erano costantemente assediati. Spettri senza volto e marionette create dal Caos — gli **Spammer della Notte** — strisciavano tra i canali di discussione, seminando discordia e incantesimi fasulli. I moderatori, pur valorosi, non potevano essere ovunque contemporaneamente.\n\nFu allora che uno degli 11 Saggi comprese la necessità di un'astuzia superiore: non serviva una semplice guardia, ma un **esca divina**.\n\nL'Operatore scavò nel codice stesso del server e forgiò un canale proibito, celato ma visibile a chiunque cercasse di insinuarsi con inganno. Lo chiamò **\"Antro dell'Oblio\"**. All'apparenza, sembrava una piazza incustodita, un luogo vulnerabile dove le ombre credevano di poter urlare i propri incantesimi fraudolenti senza essere viste. In realtà, era un altare di contenimento.\n\n\n## Il Meccanismo del Bando Supremo\n\nIl Drago dell'Esilio fu incatenato nell'ombra di quel canale, addormentato ma infinitamente vigile. La regola fidata del rito era spietata ed essenziale:\n\n1. **L'Adescamento:** Le marionette fasulle, cieche e guidate da algoritmi oscuri, venivano inesorabilmente attirate dal canale esca.\n2. **Il Sacrilegio:** Nel momento esatto in cui un account spuria digitava anche una sola parola o inviava un singolo costrutto corrotto (un link o un messaggio automatico)...\n3. **Il Risveglio:** Gandora spalancava le sue enormi ali e inizia sfoderare i suoi raggi mortali proibiti.\n\n\n## Il Soffio della Purificazione\n\nUn bagliore viola e nero avvolgeva l'istante della violazione. Il Drago non concedeva udienze, non ascoltava suppliche e non conosceva esitazione.\n\nCon un ruggito capace di far vibrare le fondamenta dell'intero server, scatenava il **Soffio dell'Oblio**:\nUn raggio di pura energia purificatrice che recideva all'istante l'anima dell'account intruso dal tessuto della Land. In una frazione di secondo, il messaggio venivo incenerito e l'account bandito nei territori desolati fuori dal reame, senza possibilità di ritorno.\n\n```\n[ SISTEMA ]: L'intruso ha varcato il portale.\n[ GANDORA ]: Soffio dell'Oblio attivato.\n[ STATO ]: Account polverizzato ed esiliato per sempre.\n\n```\n\n\n## Un Monito per l'Eternità\n\nOggi, i cancelli della Land di Arcamis giace in apparente silenzio. Gli utenti legittimi passeggiano nelle sale della Land protetti e indisturbati, ignari dei continui attacchi che si consumano nell'ombra.\n\nDi tanto in tanto, un'ombra spavalda varca ancora la soglia del canale proibito. Ma il finale è sempre lo stesso: un bagliore repentino, un colpo di coda del Drago e il silenzio che ritorna sovrano. Gandora veglia, eterno e inamovibile, a guardia della pace del Reame.",
  "layout": "wide",
  "lastModified": "2026-08-11T19:44:22.234Z",
  "meme": true
}
