{
  "k": "inizia",
  "title": "Come si inizia",
  "icon": "🌟",
  "content": "---\n\n# Cosa sapere per creare il pg\n\n- Il pg inizia dal livello 1 (0 xp)\n### Punti caratteristica\n\n\n\n- I punteggi caratteristica possono seguire il Point Buy o lo Standard Array (15-14-13-12-10-8... scegliendo, ovviamente, a quale stat assegnare quale numero)\n- Fino al livello 12, potrete avere un solo PG attivo.  Arrivato il primo PG a livello 12, vi consentiamo la creazione di un secondo. Potrete avere fino a 2 pg attivi, che non potranno mai interagire tra loro in alcun modo (non potranno neanche partecipare alle stesse missioni).\n\n\n### Inventario iniziale\n\n\n\nOltre i suoi item iniziali (Potete trovarli su 5e), i gp iniziali per ogni pg saranno:\n\n\n\n- Partendo dal livello 1, un personaggio inizia con 50gp;\n- Partendo da un livello maggiore (Per specifici motivi), vi invitiamo a visitare \n\n\n## Processo di creazione\n\n\n\nDurante tutto il processo, sarete accompagnati nella creazione del pg dall’Assistenza Tecnica. \nAperto un [ticket](https://discord.com/channels/1348723468157456425/1348747889924374530), vi forniremo noi una scheda da compilare (La scheda non deve essere copiata, in quanto dovrete usare quella che vi viene fornita).\n\n> 💡 Specificare, in fase di creazione, la tipologia di Selezione Punti Abilità che avete scelto.\n\n\n\nOltre la scheda, vi chiederemo di:\n\n- Scrivere un background (la storia del pg) breve e semplice. Non richiediamo una saga epica ma necessitiamo comunque di qualcosa che sia consono alla lore del mondo di gioco e che abbia senso per un pg livello 1;\n- Settare la bag (compresa la borsa dei soldi), stesso all’interno del ticket, chiedendo aiuto all’Assistenza Tecnica.\n\n\n### **Gestione PG**\n\n\n\nIl personaggio alla creazione parte dal livello 1, fino al livello 4 (compreso) si ha diritto a un cambio pg senza perdere livelli per **situazioni eccezionali **(cosa che verrà valutata dal corpo Master), questo è un privilegio usabile solamente una volta per tutta l'esperienza nel server.\n\nLa procedura standard in caso di morte del PG, ritiro di  esso o cambio standard a disposizione del player sarà:\n\n- **LV Vecchio PG - 1 **e **Metà del Valore Totale di Bag**\nQuindi la procedura standard di cambio PG rimarrà invariata\n\n\n\n\n\n\n\n\n\n",
  "lastModified": "2026-08-03T09:23:05.194971Z"
}