{
  "k": "lavori-nella-land",
  "title": "Lavori nella Land",
  "icon": "📄",
  "content": "Come discorso di base, ci teniamo a precisare che ogni lavoro richiede turni di 8 ore al giorno per 7 giorni.\nDetto questo, ecco l’elenco dei vari lavori disponibili:\n\n## Biblioteca\n\nUn silenzio rispettoso avvolge un luogo sacro, carico di storia e memoria.\n\nFai attenzione a ogni passo: il capo dello staff non tollera chi disturba la quiete.\n\n- **1:** 1\n\n### Stipendio\n\nLo stipendio dipende da:\n\nA) Livello del PG\n\n> • Apprendista (Livelli 1-5) = 15 mo base\n• Professionista (Livelli 6-12) = 25 mo base\n• Mastro (Livelli 13-20) = 35 mo base\n> \n\nB) Giorni di lavoro\n\n> • I primi 5 giorni, avrete lo stipendio base descritto nella variabile A (Chi fa meno di 5 giorni, non viene pagato);\n• Successivamente, avrete stipendio extra, in base dagli stock bonus completati (5 giorni per stock, per un massimo di 4 stock bonus)\n> \n\nC) Modificatore caratteristica del lavoro\n\n> • Ogni lavoro ha due modificatori caratteristica tra cui scegliere, che aumenteranno il vostro stipendio.\n• Per questo lavoro, sono **Intelligenza (INT) o Carisma (CHA).**\n\n## Bottega Farmaceutica\n\n## Caserma\n\n## Corporazione Costruttori\n\n## Forgia\n\n## Locanda\n\n## Ospedale\n\n## Sartoria\n\n## Tribunale",
  "layout": "generico",
  "lastModified": "2026-08-17T16:28:10.209Z"
}