{
  "k": "biblioteca",
  "title": "Biblioteca",
  "icon": "📚",
  "content": "\nUn silenzio rispettoso avvolge un luogo sacro, carico di storia e memoria.\n\nFai attenzione a ogni passo: il capo dello staff non tollera chi disturba la quiete.\n\n## Stipendio\n\n\nLo stipendio dipende da:\n\n\nA) Livello del PG\n\n> • Apprendista (Livelli 1-5) = 15 mo base\n• Professionista (Livelli 6-12) = 25 mo base\n• Mastro (Livelli 13-20) = 35 mo base\n\nB) Giorni di lavoro\n\n> • I primi 5 giorni, avrete lo stipendio base descritto nella variabile A (Chi fa meno di 5 giorni, non viene pagato);\n• Successivamente, avrete stipendio extra, in base dagli stock bonus completati (5 giorni per stock, per un massimo di 4 stock bonus)\n\nC) Modificatore caratteristica del lavoro\n\n> • Ogni lavoro ha due modificatori caratteristica tra cui scegliere, che aumenteranno il vostro stipendio.\n• Per questo lavoro, sono **Intelligenza (INT) o Carisma (CHA).\n**\n\n\n\n---\n\n![](https://prod-files-secure.s3.us-west-2.amazonaws.com/fba0274f-dc1c-8128-a70c-0003af9f37a4/82aa3301-81e4-4867-a9d7-82094d0cc43a/trasferimento.jpeg?X-Amz-Algorithm=AWS4-HMAC-SHA256&X-Amz-Content-Sha256=UNSIGNED-PAYLOAD&X-Amz-Credential=ASIAZI2LB4665GGDGCLX%2F20260803%2Fus-west-2%2Fs3%2Faws4_request&X-Amz-Date=20260803T092311Z&X-Amz-Expires=3600&X-Amz-Security-Token=IQoJb3JpZ2luX2VjECgaCXVzLXdlc3QtMiJGMEQCIB4UVgax0pCkVLPE2GBqh%2BiBYZwT8rOG%2Bleuxs%2Fpxuy3AiACK9KGDhMIDP3Ovna5IgRPqxyq%2B5gzmLWkyAo6RBmRAiqIBAjx%2F%2F%2F%2F%2F%2F%2F%2F%2F%2F8BEAAaDDYzNzQyMzE4MzgwNSIMBM%2B835FNHZUisw1sKtwD8FYYgDpNdE%2BE9zCtv6N7m40tcfymasRG9n1ZUF6Ani9o6DuyRATojG9yt4BNBV5BfdNRvJT9K%2FTaHwKKrd%2Bj2drAPOiHLrTkEfs6qGLA8RStugq8%2BAoXnNQqaWIZR7Txa3vVjWcfd7dCPXibEIFURE8GygAGXwAhRrR60cECYDAlabzMzVroVMLMBnwKYL3CByfSijJrycyLTAwO1r%2BWs32Je2Jl4xEu4iC3jVcvtwb3AuzjCZIlOTNCFWnOQZ9YfDr6ymbCaBDU7o%2FLHEUXHfi%2FYnyjOP8Pi9mw%2FmNuSwQG4NCVub7oqanw5F6T9lIRVEFupfywilcvxhO5HExkoQcrKNnF5gY%2FOYvd29ixYECPkXbBBirQ50zCOlN5wwUlROHVU3cSjr8X%2FBaPRaWU2hyau5LOhMtkDXTpPnNbEqezENkjM19OwhljsMsRu9RJrVJ6eOWLCYs2CW2FabCZI7htCDsUJf8w8ExMGXgOQJWpjnnw3iqhl4ylbwqGGnW6TNe8iJM9aWpYF4W7Pm24TUtQp7x9ujXjHX4v1%2BwzjHTtNP%2FYLIOZDVOp9dfN%2Fff%2F3rJ6RABzg41lY2pwR02u3tfDBDvx9sfuQGomOlRZ7gNG0mbN3Nal2USbLXIwp4fB0wY6pgFiVV%2BRH417SBTmUJBg6ZAXri8dvcbbX92ut1KW67GKiEmsrbkyOaOzBKUx%2FkL4HRZbN17xlSTxU1R9N%2BewYGGKLu0uiSqvSFSs2EdSB9MzmWRRFJtagiNcEiJ5EaHJ%2Bab02xWWjwLPXSiDW0r9q2lwXTLwbYYrnb6mu8F4lm5dMCfVMUwwexlsUxsJTsxE7iOhh7tm9L99TcRHLviDTWMM2N3ftUqb&X-Amz-Signature=32d879d38e55e215d27d7cebe7959eee2165427d0893d7e752bf5900dd9c4b78&X-Amz-SignedHeaders=host&x-amz-checksum-mode=ENABLED&x-id=GetObject)\n\n\n\n",
  "layout": "",
  "lastModified": "2026-08-12T15:03:19.046Z"
}