{
  "k": "locanda",
  "title": "Locanda",
  "icon": "🍺",
  "content": "Un silenzio avvolge un luogo tanto sacro e pieno di storia. Non fare rumore, il capo dello staff non ci va piano con chi disturba la quiete.\n\n\"Mh, cosa serve? I prezzi li vedi sui cartelli\"\n\nEsposti, vari cartelli\n\n```\n- Una stanza per un mese costa 6gp\n- Una stanza doppia costa 10gp \n- Un pasto costa 8sp\n- Per gli alcolici, 3sp un bicchiere / 5gp una bottiglia\n\n```\n\n```\n \"Se sei avventuriero o un membro del nostro staff: \n - 5gp al mese per vitto ed alloggio per una stanza singola \n - 8gp al mese per vitto ed alloggio per una stanza doppia\n Gli alcolici sono esclusi!\"\n```\n\nEssendo la Locanda parte dello stesso edificio, in caso i posti a sedere fossero pieni, i tavoli della Gilda degli Avventurieri possono essere sfruttati per sedersi a mangiare.\n\nP.S. I 5 gp al mese, comprendono 2gp di Tessera Avventuriero + 3gp di Locanda. 8 gp al mese, comprendono 4gp di Tessera (2 per giocatore) + 4gp di Locanda (2 per giocatore).\n\n## Stipendio\n\n\nLo stipendio dipende da:\n\n\nA) Livello del PG\n\n> • Apprendista (Livelli 1-5) = 15 mo base\n> • Professionista (Livelli 6-12) = 25 mo base\n> • Mastro (Livelli 13-20) = 35 mo base\n\nB) Giorni di lavoro\n\n> • I primi 5 giorni, avrete lo stipendio base descritto nella variabile A (Chi fa meno di 5 giorni, non viene pagato);\n> • Successivamente, avrete stipendio extra, in base dagli stock bonus completati (5 giorni per stock, per un massimo di 4 stock bonus)\n\nC) Modificatore caratteristica del lavoro\n\n> • Ogni lavoro ha due modificatori caratteristica tra cui scegliere, che aumenteranno il vostro stipendio.\n> • Per questo lavoro, sono **Destrezza (DEX)** o **Carisma (CHA).**\n\n\n\n\n\n---\n\n![](https://prod-files-secure.s3.us-west-2.amazonaws.com/fba0274f-dc1c-8128-a70c-0003af9f37a4/1f867dc5-42e4-464d-b80a-2922596305ef/ca43c701-64be-4067-b49e-131868213707.webp?X-Amz-Algorithm=AWS4-HMAC-SHA256&X-Amz-Content-Sha256=UNSIGNED-PAYLOAD&X-Amz-Credential=ASIAZI2LB4665VVKXMJS%2F20260803%2Fus-west-2%2Fs3%2Faws4_request&X-Amz-Date=20260803T092320Z&X-Amz-Expires=3600&X-Amz-Security-Token=IQoJb3JpZ2luX2VjECgaCXVzLXdlc3QtMiJGMEQCIFLnvH%2Fa66l2wCa28oHo1JtoLaqKoZ3cZcvIP9wLTzt5AiAwIpaI8rk5UbwwIkHN54Voyyidurkoj6%2FTeKpGesr%2FCyqIBAjx%2F%2F%2F%2F%2F%2F%2F%2F%2F%2F8BEAAaDDYzNzQyMzE4MzgwNSIMtPcaeTGmj3bJ3Ne9KtwDqlBE58qJ0nDSW0TtRFpKMeHXPVvpuTw2oYsCjKBrgE%2FvErObzivWGyt9x7fArMx%2BoeFM8F4jNwsQhGCcvAL%2F6k0JAdD6X1VoUtZhZhgwUicMiaLdP%2BbOr%2BhJ9bbKZ41DDahNosE%2BxbJZME%2BoeQzT9bt8CzeCLJJ1%2BnOusrORlTnI8ic5YCGEep3Tw8EvDv3YwcOy6BavQCb1b%2FjRDLzmPdoHecYSp64d%2BdnjDJ9GBgMsS14W82MNxweHoN6O2YpRhc%2ByTgN%2B7r9JNI6koRA%2FFZpgkzYcp6OBPNJfDXCAbZOOMLrInOMGLhCymaZx1LEebGTkrIgn1Uio9O7FudorJ4dK07IzVNDktGP6J4lQg9J9xyKr73avnV9BaJh3hF9JCXv7dJakiTrRjhXUyVjHuHALENEv5FArZVW091UNz4V2y%2FQMyqOdNzU6261ttbqkXvJD1cp0RfSOkBHtRx0xHzHv3Vs%2FxaeoJ4oZ7g9JPQY9QTcJXniUBhGfI9tzfBL9jFhNL0lyPoKURBgIwyTVvZsr4j%2FmC0vOmtSDcA2GyECLMg4dduJPEHXA85cAewJe6hE1D0DKI78Dzk1JfRU6CwuPC6KUyBYBwTVlji1q3exakpzpOobphrI%2FuGEwkYnB0wY6pgHQ6A7Zd8860BYdOY9EToRf9F1807bY7q6bL5Hlfou0Cix6mYzcSUuVb7Nnfhx0kI0ITpGEYeNyfUG%2Bk4Y%2FodJ2rpxz8BNlPltAOBA6FLjaVIyfCtGY0kMUrdSyVm4U5aYAS16w%2B44J7Msrmf8cDvQ8kDpRmTa%2FSgl6n8BIUkEmX80CEG0wCeV7LNYP8clofiRPNkxWe31b5lzrYSxpbzgqW00QI2rL&X-Amz-Signature=282580c4a3a7417b299f11ba860a8b7ad2f1d96e2bcef438b8529280b638789c&X-Amz-SignedHeaders=host&x-amz-checksum-mode=ENABLED&x-id=GetObject)\n\n",
  "layout": "",
  "lastModified": "2026-08-14T10:07:30.254Z"
}