{
  "k": "deserto",
  "title": "Forgia",
  "icon": "🔥",
  "content": "La forgia, dove echi di martelli a lavoro ed il calore del fuoco, avvolgono l'atmosfera.\n\nCome fabbro, puoi forgiare e riparare armi ed armature, lavorare minerali ed anche oggetti mondani (Ovviamente quelli che possono essere creati da un fabbro).\n\n## Stipendio\n\n\nLo stipendio dipende da:\n\n\nA) Livello del PG\n\n> • Apprendista (Livelli 1-5) = 15 mo base\n> • Professionista (Livelli 6-12) = 25 mo base\n> • Mastro (Livelli 13-20) = 35 mo base\n\nB) Giorni di lavoro\n\n> • I primi 5 giorni, avrete lo stipendio base descritto nella variabile A (Chi fa meno di 5 giorni, non viene pagato);\n> • Successivamente, avrete stipendio extra, in base dagli stock bonus completati (5 giorni per stock, per un massimo di 4 stock bonus)\n\nC) Modificatore caratteristica del lavoro\n\n> • Ogni lavoro ha due modificatori caratteristica tra cui scegliere, che aumenteranno il vostro stipendio.\n> • Per questo lavoro, sono **Costituzione (COS) o Forza (STR).**\n\n\n\n\n\n---\n\n![](https://prod-files-secure.s3.us-west-2.amazonaws.com/fba0274f-dc1c-8128-a70c-0003af9f37a4/11e2728d-c6c9-4083-957a-df4cd360ab26/73e8e4cb-e14f-4d88-9153-bed5b6c0eb70.webp?X-Amz-Algorithm=AWS4-HMAC-SHA256&X-Amz-Content-Sha256=UNSIGNED-PAYLOAD&X-Amz-Credential=ASIAZI2LB466WZAZ4VEA%2F20260803%2Fus-west-2%2Fs3%2Faws4_request&X-Amz-Date=20260803T092318Z&X-Amz-Expires=3600&X-Amz-Security-Token=IQoJb3JpZ2luX2VjECgaCXVzLXdlc3QtMiJGMEQCIFY2IAn4LiHqbgl4oIKnHQYDgMO%2BBRdAjyV%2F0X5puM7JAiAcOwGEm8ojSfzuw5o8yUA%2Blx218bovknKhTeaP8FJieyqIBAjx%2F%2F%2F%2F%2F%2F%2F%2F%2F%2F8BEAAaDDYzNzQyMzE4MzgwNSIMQL5NRU%2FefxSCduuSKtwDlXZd2UlPE%2Bv65iozglEYRoQC%2Fnz0bZZBCXSsNALujXg52sdKDdg4L3JWsxQ1BMQk15PnQcQj6b5etREpX4Hbp1MJ3GqmcrpYb2DL%2BBiHrUkwhmGj5ps1kvPEz4Wc89NzKbauBkqtrNwn3sPQqtPblgjdhet2F3PpSN0dsNy0lOjedAGHAdT1MzTweJiBEpZJJnCerCY7Gh%2B6Kf%2BLZikSwHP305AGHuiMknrxh6sT%2BU5bFeSVdj36G15Tkvxk3MvB9JZpK0Bhgr25EmjrOecmxgf3HVgsW30wj9r%2F4rlhadF46JXc5z77cviv7bOdM09Zu5JSROA2tn9k8BiDLhtb%2B%2F5dHpT6UBwa5MCZHAdnarS6P7B5Dnn7enyVvvnQVjdxbXfy8CdO%2F%2FN27GtudquqqZq6o1xp2BDgj1ttJFg%2BTEYIHlJATWxGNavGHx3oVh%2FLyH8KDhMqqmztMJ8En6s6BdBDGMQky99ANzCqXkrihjh5UFj6h8TN1rbQt%2B3JBxA9nje0%2Fm2TFlgARNq0v9KRkpsqTuRvWoUK35b132lgnVk1KMFSq%2BMm3JTUhZFwKB5TXeFYW5zark%2FNb0HkaSdKhvBbzEHPrypmkCM6C0ibqzarWm0ozCMCbuCzc4MwpIfB0wY6pgHuymMlLYaHymIjBD7Ju%2B46fd6jtm7JmDNV1uMeQZfNWGUHPGRVywnq7iS2Pb0KbTEp%2B%2BamwBf8q3eOkfjxCZgG5aEmMEDllVxML0%2Fp5aBYFr3ofuLCmpqT5vSMzLSSDeKgbuYaX3Kg%2FxUEX7k1FYbNBkBg3d4b9Ci99liBEgAQKNsAiHUUxT0GXX%2FrH%2F4VvGtuzh3abd3X2VP4lXeGi%2F3lGTSGZ4lV&X-Amz-Signature=a9f3ed5d791ed0638612b5d8c7a5742dcaf0f4c397d32f1f2265c205a3f1de7a&X-Amz-SignedHeaders=host&x-amz-checksum-mode=ENABLED&x-id=GetObject)\n\n",
  "layout": "",
  "lastModified": "2026-08-14T10:09:13.967Z"
}