{
  "k": "sartoria",
  "title": "Sartoria",
  "icon": "🧵",
  "content": "La sartoria è un ambiente accogliente e ordinato, profumato di stoffa e cera per aghi. \nScaffali colmi di tessuti colorati rivestono le pareti, mentre manichini e abiti in lavorazione occupano lo spazio centrale. \nSu grandi tavoli di legno riposano forbici, metri e rocchetti di filo, e il ticchettio degli strumenti da cucito riempie l’aria con un ritmo tranquillo e operoso.\n\n\n\n## Stipendio\n\n\nLo stipendio dipende da:\n\n\nA) Livello del PG\n\n> • Apprendista (Livelli 1-5) = 15 mo base\n> • Professionista (Livelli 6-12) = 25 mo base\n> • Mastro (Livelli 13-20) = 35 mo base\n\nB) Giorni di lavoro\n\n> • I primi 5 giorni, avrete lo stipendio base descritto nella variabile A (Chi fa meno di 5 giorni, non viene pagato);\n> • Successivamente, avrete stipendio extra, in base dagli stock bonus completati (5 giorni per stock, per un massimo di 4 stock bonus)\n\nC) Modificatore caratteristica del lavoro\n\n> • Ogni lavoro ha due modificatori caratteristica tra cui scegliere, che aumenteranno il vostro stipendio.\n> • Per questo lavoro, sono **Destrezza (DEX) o Carisma (CHA).**\n\n\n\n![](https://prod-files-secure.s3.us-west-2.amazonaws.com/fba0274f-dc1c-8128-a70c-0003af9f37a4/0a540ba7-4038-41bd-9f9c-7429db558ba7/immagine_2026-02-06_154710240.png?X-Amz-Algorithm=AWS4-HMAC-SHA256&X-Amz-Content-Sha256=UNSIGNED-PAYLOAD&X-Amz-Credential=ASIAZI2LB466YA3DD2UY%2F20260803%2Fus-west-2%2Fs3%2Faws4_request&X-Amz-Date=20260803T092323Z&X-Amz-Expires=3600&X-Amz-Security-Token=IQoJb3JpZ2luX2VjECgaCXVzLXdlc3QtMiJHMEUCIAq0RV6lLwaCTn8QcJBXcl23MmH5hh%2Fx%2BO63giEq7XCaAiEA4fQwVMPjQYcJPOqT1ItWDfu8EepRQ0L2x%2FjQ%2BtrhRN4qiAQI8f%2F%2F%2F%2F%2F%2F%2F%2F%2F%2FARAAGgw2Mzc0MjMxODM4MDUiDJ71EMcQ%2BG4lPnJsdyrcA4t3pcqQdpqLyu3isHrjBgM%2FvoTE3MvwRyuO2PewJnzV6HhyVmcQmU7hHziW8yRdHO6Skv%2F%2Fiv5bVIJyXPjDz1o9LHK7ssMq9hQeIPsRhoGcGkw1ZiExDdI40wBGWRn7QrZTFRVhhE3LK%2BpR1EicNNmkhRfJLyk1dkEY2T0lMjKcbYrgq5nF51ZJdhMaWPj5d9aMJRprl2ezXaLScUit0OkD2KXI7HUdhNekKh%2BE%2Bd1swdVfedxb3pI2mb3al%2F%2BvlcYp3eLTrI%2FeTiEU2X8NwYaZhmvnpy9AaF8xjzDMmvlNVDqO%2FcfEc6vt%2F7Uv6iBEFZMQg47ILDWOfvfsJFvXvpul%2FNPpDC%2BZkDEx4wdWfO3EjOdESGb3jjmBGWJf29%2BSf0fnOb0Do%2FbbvpajTsNf1hj3wXQ%2F6GQMcBhc9nCdh%2FGlpOOtzNkXZHl2Gc8j2xoraKpGYuMXTd9fJMEJK6wSwuUycA4WSezOdp6q%2BRYb935cTmeoYpvk3Lv4dMYJbRSELAMSyqANAvKY%2BfOdi7QO5ieNZa4e7h%2FbQHDf1lpFnO%2FN9yvmvkbgGkZW6tv9IZsVbtR9ZdEmolsc7vKGEn0M7ZVStv3hzrjaxqaziLCXrY6LmTk2wWcjrB6GpAU9MKeHwdMGOqUBAZ6uu8L9cxsTUtl7uvh6D7nn6u8cs7iYfiOMzB9t5ZnLLvNVpMFs4a7D2d0Aqkcb2dM7q6kv%2Bg08Tkd0s%2B3acxB7%2BPlGCFIPY7WkoA5Cqd2%2FmbNK%2FRget1EGnWmiHWi476dCkuReyli%2FK43iSd9P0hDI5qXit914gRj7oOzovSGK%2BLE558pinnxjV3B5P9BVLqHDn3I%2FkgHmSa2JvZMv4qgFzO64&X-Amz-Signature=af9f374b44a4d132e53e96cfa7664d14b944fe9ccc98473fdde93ee42cad321f&X-Amz-SignedHeaders=host&x-amz-checksum-mode=ENABLED&x-id=GetObject)\n\n",
  "layout": "",
  "lastModified": "2026-08-14T10:08:03.153Z"
}