{
  "k": "credits",
  "title": "Crediti & Legale",
  "icon": "⚖️",
  "layout": "",
  "lastModified": "2026-10-18T06:42:06.504Z",
  "content": "Arcamis è una campagna amatoriale di **Dungeons & Dragons 5ª edizione** gestita su Discord da una community di giocatori. Questa wiki raccoglie il materiale della campagna: regole della casa, ambientazione, divinità, mestieri e strumenti per creare il personaggio.\n\n---\n\n## Crediti\n\n### Testi e ambientazione\nTutti i testi pubblicati su questo sito sono scritti e curati dal **DM e dalla community di Arcamis**. Il mondo di Arcamis, i suoi luoghi, le sue divinità e le sue fazioni sono opera originale della campagna: non derivano da manuali pubblicati e non sono affiliati a Wizards of the Coast.\n\n### Immagini\nAlcune immagini di ambientazione e i ritratti del pantheon provengono da **League of Legends**, proprietà di **Riot Games, Inc.** Sono utilizzati qui esclusivamente come riferimento visivo *senza scopo di lucro*, all'interno di una campagna privata di gioco di ruolo.\n\n- I personaggi, le illustrazioni e i marchi citati appartengono ai rispettivi titolari: **Riot Games, Inc.** per League of Legends; **Wizards of the Coast** per Dungeons & Dragons.\n- Questa wiki **non è affiliata, sponsorizzata o approvata** da Riot Games né da Wizards of the Coast.\n- Nessuna immagine è venduta, concessa in licenza o ridistribuita a fini commerciali.\n\nSe sei un titolare dei diritti e desideri la rimozione di un contenuto, scrivici sul Discord della community: provvederemo alla rimozione immediata.\n\n### Artisti delle illustrazioni\n\nLe illustrazioni dei campioni del Pantheon sono **splash art ufficiali di League of Legends**: appartengono a **Riot Games** e agli artisti che le hanno realizzate. La wiki le riproduce come riferimento visivo per la campagna, senza modificarle nella sostanza e senza ricavarne alcun guadagno.\n\n| Illustrazione | Fonte | Attribuzione |\n| --- | --- | --- |\n| Ritratti del Pantheon | Splash art ufficiali di League of Legends | Riot Games e gli artisti delle splash art |\n| Immagini di ambientazione | Reference visivi raccolti per la campagna | Autori da attribuire: segnala il tuo credito |\n\nDove un'immagine è ritagliata o adattata per la scheda, l'intervento riguarda solo inquadratura, formato e dimensioni: l'opera originale non viene alterata.\n\n**Segnalazioni:** se sei l'autore di un'illustrazione e non trovi l'attribuzione corretta, scrivici sul Discord della community: aggiungeremo il credito o rimuoveremo l'immagine.\n\n### Icone e interfaccia\nLe icone dei menu sono emoji di sistema. Il font del titolo è **Cinzel** e il font di testo è **Crimson Pro**, entrambi distribuiti con licenza **SIL Open Font License 1.1** e serviti direttamente da questo dominio (nessuna richiesta a server di terze parti).\n\n---\n\n## Privacy\n\nQuesta wiki è un sito statico: non usa cookie di profilazione, non vende dati e non incorpora tracker pubblicitari o social.\n\n### Dati tecnici\nL'hosting (Cloudflare Pages) registra log tecnici anonimi per erogare il sito e difenderlo da abusi. Non sono usati per profilare i visitatori.\n\n### Conteggio delle visite interne\nIl pannello di amministrazione conta quante volte viene aperta ogni pagina, per capire quali contenuti interessano di più alla community. Il conteggio:\n\n- **non salva l'indirizzo IP** né lo user-agent completo;\n- **non usa cookie** e non crea un identificativo del visitatore;\n- registra solo un contatore aggregato per pagina e una serie giornaliera, conservati nell'archivio del sito.\n\nNon è quindi possibile risalire a una persona specifica a partire da questi dati.\n\n### Preferenze locali\nTema, dimensione del testo, audio e stato dei pannelli sono salvati **solo nel tuo browser** (`localStorage`). Non vengono inviati al server e puoi cancellarli in qualsiasi momento svuotando i dati del sito.\n\n### Font\nI font sono ospitati su questo dominio: aprire una pagina non invia il tuo IP a Google o ad altri fornitori di font.\n\n---\n\n## Contatti\n\n- **Discord della community**: è il canale principale per domande, segnalazioni e candidature. Trovi l'invito nel pulsante *Discord* della barra in alto e nella home.\n- **Oracolo di Arcamis**: il pulsante flottante 🔮 in basso apre le FAQ e il modulo per scrivere direttamente al DM, senza uscire dal sito.\n- **Segnalazioni sui contenuti**: se trovi un errore, una regola poco chiara o un'informazione mancante, scrivi al DM dal modulo dell'Oracolo indicando la pagina interessata.\n\nRispondiamo appena possibile, di solito entro un paio di giorni.\n\n---\n\n## Stato dei contenuti\n\nLa wiki è in evoluzione: alcune schede del Pantheon e dei Luoghi sono **bozze** in attesa di essere completate dal DM. Le pagine in questo stato mostrano un'etichetta **Bozza** e non vanno considerate regole definitive. Le pagine della sezione *Regole* sono invece da considerarsi vincolanti per la campagna."
}
